{
  "$schema": "./document-set.schema.json",
  "schema_version": 2,
  "document_set_id": "https://github.com/0al-spec/agent-surface/publication/document-set/v1",
  "document_set_version": "0.2.0-draft.10",
  "protocol_version": "agent-surface/0.1",
  "publication_mode": "modular",
  "authority": {
    "catalog": "normative_publication_contract",
    "active_sources": "normative",
    "reserved_documents": "non_authoritative",
    "build_manifest": "provenance_only",
    "source_map": "provenance_only"
  },
  "anchor_policy": {
    "new_public_ids": "explicit_only",
    "id_syntax": "lowercase_ascii_kebab",
    "reference_tuple": "document_id_exact_version_anchor_id",
    "scope": "document_set_global",
    "move_policy": "validated_cross_document_relocation",
    "local_alias_scope": "same_document_version_or_aggregate_fragment",
    "cross_document_relocation": "exact_old_to_new_tuple_v1",
    "legacy_aggregate_aliases": [
      "github_increment_from_1",
      "dashboard_increment_from_2"
    ],
    "legacy_status": "transition_only"
  },
  "assembly_policy": {
    "compiler": "https://github.com/0al-spec/Hyperprompt",
    "revision_policy": "exact_immutable_revision",
    "manifest_role": "build_provenance_only",
    "source_map_role": "build_provenance_only",
    "output_digest_location": "source_map",
    "content_transforms": "before_provenance_bound_assembly",
    "aggregate_links": "aggregate_local_fragments_v1"
  },
  "activation": {
    "transition": "atomic_catalog_transition",
    "requirements": [
      "all_sources_exist",
      "closed_dependency_graph",
      "single_owner_per_export",
      "aggregate_provenance_ready",
      "legacy_references_resolved",
      "validators_pass"
    ],
    "partial_activation": "forbidden"
  },
  "aggregate": {
    "path": "drafts/agent-surface.md",
    "sha256": "19bbe3e5e59ccdad4d8560517981f9e9b7fe6d321a9d659f88ebc4db85733188",
    "generated": true,
    "role": "exact_document_set_representation",
    "assembly": {
      "compiler": "https://github.com/0al-spec/Hyperprompt",
      "compiler_revision": "d76e0a057c44fd249cf4f62fe856bf6054b1c264",
      "entrypoint": "publication/modular/root.hc",
      "manifest": "publication/modular/agent-surface.manifest.json",
      "source_map": "publication/modular/agent-surface.source-map.json"
    }
  },
  "documents": [
    {
      "document_id": "https://github.com/0al-spec/agent-surface/documents/core",
      "version": "0.1.0-draft.3",
      "title": "ASP Core",
      "kind": "core",
      "role": "core",
      "status": "canonical",
      "publication_order": 0,
      "source_path": "drafts/modules/core.md",
      "source_sha256": "ec35cebe1b1fb718d7dc3c4c5b03350dd808e896842c97b165a3bf91f8814659",
      "normative_dependencies": [],
      "normative_references": [],
      "public_anchors": [
        {
          "anchor_id": "asp-core",
          "heading": "ASP Core",
          "aliases": []
        },
        {
          "anchor_id": "modular-rfc-publication-architecture",
          "heading": "Modular RFC Publication Architecture",
          "aliases": []
        },
        {
          "anchor_id": "publication-authority-and-transitional-state",
          "heading": "Publication Authority and Transitional State",
          "aliases": []
        },
        {
          "anchor_id": "document-classes",
          "heading": "Document Classes",
          "aliases": []
        },
        {
          "anchor_id": "exact-normative-references",
          "heading": "Exact Normative References",
          "aliases": []
        },
        {
          "anchor_id": "namespace-and-registry-ownership",
          "heading": "Namespace and Registry Ownership",
          "aliases": []
        },
        {
          "anchor_id": "stable-anchors-and-compatibility-aliases",
          "heading": "Stable Anchors and Compatibility Aliases",
          "aliases": []
        },
        {
          "anchor_id": "version-namespaces-and-independent-lifecycles",
          "heading": "Version Namespaces and Independent Lifecycles",
          "aliases": []
        },
        {
          "anchor_id": "aggregate-assembly-and-build-provenance",
          "heading": "Aggregate Assembly and Build Provenance",
          "aliases": []
        },
        {
          "anchor_id": "atomic-modular-activation",
          "heading": "Atomic Modular Activation",
          "aliases": []
        },
        {
          "anchor_id": "host-provisioned-bearer-authentication-descriptor",
          "heading": "Host-Provisioned Bearer Authentication Descriptor",
          "aliases": []
        }
      ],
      "exports": [
        {
          "kind": "anchor_namespace",
          "id": "https://github.com/0al-spec/agent-surface/anchors/legacy-aggregate"
        },
        {
          "kind": "identifier_namespace",
          "id": "https://github.com/0al-spec/agent-surface/identifiers/agent-surface-0.1"
        },
        {
          "kind": "artifact",
          "id": "drafts/modules/core.md"
        }
      ]
    },
    {
      "document_id": "https://github.com/0al-spec/agent-surface/documents/authorization",
      "version": "0.1.0-draft.5",
      "title": "ASP Delegated Authorization",
      "kind": "extension",
      "role": "authorization",
      "status": "canonical",
      "publication_order": 1,
      "source_path": "drafts/modules/authorization.md",
      "source_sha256": "463cfad1fb88ae97f2d496a9f61a27589885a7a07b85db1c0612a7a4feb5269d",
      "normative_dependencies": [
        {
          "document_id": "https://github.com/0al-spec/agent-surface/documents/core",
          "version": "0.1.0-draft.3"
        }
      ],
      "normative_references": [
        {
          "source_anchor_id": "asp-delegated-authorization",
          "target_document": {
            "document_id": "https://github.com/0al-spec/agent-surface/documents/core",
            "version": "0.1.0-draft.3"
          },
          "target_kind": "artifact",
          "target_id": "drafts/modules/core.md"
        }
      ],
      "public_anchors": [
        {
          "anchor_id": "asp-delegated-authorization",
          "heading": "ASP Delegated Authorization",
          "aliases": []
        },
        {
          "anchor_id": "purpose-and-task-bound-agent-grant-profile",
          "heading": "Purpose- and Task-Bound Agent Grant Profile",
          "aliases": []
        },
        {
          "anchor_id": "host-provisioned-bearer-binding",
          "heading": "Host-Provisioned Bearer Binding",
          "aliases": []
        },
        {
          "anchor_id": "host-provisioned-bearer-private-issuance-and-consent",
          "heading": "Private Issuance and Exact Consent",
          "aliases": []
        },
        {
          "anchor_id": "host-provisioned-bearer-control-transport",
          "heading": "Common Control Transport",
          "aliases": []
        },
        {
          "anchor_id": "host-provisioned-bearer-self-validation",
          "heading": "Self-Only Grant Validation",
          "aliases": []
        },
        {
          "anchor_id": "host-provisioned-bearer-self-revocation",
          "heading": "Self-Only Revocation and User Management",
          "aliases": []
        },
        {
          "anchor_id": "host-provisioned-bearer-qualification-requirements",
          "heading": "Qualification Requirements",
          "aliases": []
        }
      ],
      "exports": [
        {
          "kind": "artifact",
          "id": "drafts/modules/authorization.md"
        }
      ]
    },
    {
      "document_id": "https://github.com/0al-spec/agent-surface/documents/safe-effects",
      "version": "0.1.0-draft.5",
      "title": "ASP Safe Effects",
      "kind": "extension",
      "role": "safe_effects",
      "status": "canonical",
      "publication_order": 2,
      "source_path": "drafts/modules/safe-effects.md",
      "source_sha256": "8d6566cd5864d64db5cff802b501a14b27965d74887eeab8461adf877183209e",
      "normative_dependencies": [
        {
          "document_id": "https://github.com/0al-spec/agent-surface/documents/core",
          "version": "0.1.0-draft.3"
        },
        {
          "document_id": "https://github.com/0al-spec/agent-surface/documents/authorization",
          "version": "0.1.0-draft.5"
        }
      ],
      "normative_references": [
        {
          "source_anchor_id": "asp-safe-effects",
          "target_document": {
            "document_id": "https://github.com/0al-spec/agent-surface/documents/core",
            "version": "0.1.0-draft.3"
          },
          "target_kind": "artifact",
          "target_id": "drafts/modules/core.md"
        },
        {
          "source_anchor_id": "asp-safe-effects",
          "target_document": {
            "document_id": "https://github.com/0al-spec/agent-surface/documents/authorization",
            "version": "0.1.0-draft.5"
          },
          "target_kind": "artifact",
          "target_id": "drafts/modules/authorization.md"
        }
      ],
      "public_anchors": [
        {
          "anchor_id": "asp-safe-effects",
          "heading": "ASP Safe Effects",
          "aliases": []
        }
      ],
      "exports": [
        {
          "kind": "artifact",
          "id": "drafts/modules/safe-effects.md"
        }
      ]
    },
    {
      "document_id": "https://github.com/0al-spec/agent-surface/documents/evidence",
      "version": "0.1.0-draft.6",
      "title": "ASP Evidence",
      "kind": "extension",
      "role": "evidence",
      "status": "canonical",
      "publication_order": 3,
      "source_path": "drafts/modules/evidence.md",
      "source_sha256": "255de1bb9b0587e7ded8a39bf2e2b5d0385c3c695b2a4a2d0d4581db592cd881",
      "normative_dependencies": [
        {
          "document_id": "https://github.com/0al-spec/agent-surface/documents/core",
          "version": "0.1.0-draft.3"
        },
        {